{
  "command_authority_granted": false,
  "commerce_mode": "ZERO_PRICE_SHADOW",
  "created_at": "2026-08-31T18:27:14Z",
  "dataset_payload_download_authorized": false,
  "external_effect_authorized": false,
  "home_repository": "Hawkar-usls/Hawkar-usls",
  "market_repository": "Hawkar-usls/JANUS-MACHINE-MARKET",
  "money_enabled": false,
  "packet_hash": "5c30bd62e97c1df43c03627e2292cd30dd26cab8e2aac92c451805597b123b31",
  "packet_id": "dsp-shadow-90aef66a7e3c1fb38cbebc8381145eefeb52dce7af6f72b3",
  "payment_reference": null,
  "purchase_grant": {
    "execution_authority_granted": false,
    "purchase_id": "pur-ds-shadow-665c96c1a8d5cef04736e4585e5c4e1c",
    "reasons": [
      "ZERO_PRICE_SHADOW_SERVICE_TEST",
      "PAYMENT_NOT_REQUIRED",
      "HOME_ADMISSION_REQUIRED"
    ],
    "schema": "janus.machine_market.purchase_grant.v1",
    "service_entitlement": {
      "bounds": {
        "max_catalogs": 2,
        "max_results": 1,
        "per_catalog_timeout_seconds": 8
      },
      "dataset_payload_download_authorized": false,
      "read_only": true,
      "redistribution_authority_granted": false,
      "request_id": "ds-shadow-081dc88215756b0ff335970963ca3bfc725f048303b414ca",
      "service": "JANUS.DATASET_SCOUT"
    },
    "sku": "JANUS.DATASET_SCOUT",
    "status": "PURCHASE_ELIGIBLE"
  },
  "purchase_grant_hash": "2fc17afa504112c6e84ee0ef4c6dfb89614f788ca18c9a591de40ede55dc4760",
  "redistribution_authority_granted": false,
  "return_route": {
    "repository": "Hawkar-usls/JANUS-MACHINE-MARKET",
    "source_issue_id": 5303516407,
    "source_issue_number": 35
  },
  "schema": "janus.machine_market.home_dataset_scout_packet.v1",
  "service_request": {
    "bounds": {
      "max_catalogs": 2,
      "max_results": 1,
      "per_catalog_timeout_seconds": 8
    },
    "buyer_actor_id": "github:Hawkar-usls",
    "command_authority_granted": false,
    "dataset_payload_download_authorized": false,
    "date_range": null,
    "domain": "",
    "external_effect_authorized": false,
    "format_preferences": [],
    "license_preferences": [],
    "query": "P=NP",
    "read_only": true,
    "redistribution_authority_granted": false,
    "request_hash": "d3da4c7f3efe07ea48834f3142ef6131b0252cea55356b7991ec8c3692eb5e1b",
    "request_id": "ds-shadow-081dc88215756b0ff335970963ca3bfc725f048303b414ca",
    "schema": "janus.market_service.dataset_scout_request.v1",
    "sku": "JANUS.DATASET_SCOUT"
  },
  "service_request_hash": "d3da4c7f3efe07ea48834f3142ef6131b0252cea55356b7991ec8c3692eb5e1b",
  "sku": "JANUS.DATASET_SCOUT"
}
